<?xml version="1.0" encoding="UTF-8"?>
<contactLists xmlns:xsi="http://www.w3.org/2001/XMLSchema-instance" xsi:noNamespaceSchemaLocation="contactListSchema.xsd"><contact><id>144525632412</id><image>image/anonymous.png</image><firstName>Dylan</firstName><lastName>Blais</lastName><gender>M</gender><nickName>db</nickName><dateOfBirth>2012-02-02</dateOfBirth><postalDetails><city>Mahebourg</city><street>Rue Boulangerie</street><postalCode>rgregrger</postalCode><country>Mauritius</country></postalDetails><emails><officeEmail>dylan@gmail.com</officeEmail><privateEmail>Blais@you.fr</privateEmail></emails><telephoneNumbers><privateMobile>51234567</privateMobile><office>1234567</office></telephoneNumbers></contact><contact><id>144525632466</id><image>image/anonymous.png</image><firstName>Olivier</firstName><lastName>Giroud</lastName><gender>M</gender><nickName>ol</nickName><dateOfBirth>2012-02-02</dateOfBirth><postalDetails><city>Paris</city><street>Rue notre Dame</street><postalCode>rf43ft4</postalCode><country>France</country></postalDetails><emails><officeEmail>olivier@gmail.com</officeEmail><privateEmail>giroud@you.fr</privateEmail></emails><telephoneNumbers><privateMobile>51234567</privateMobile><office>1234567</office></telephoneNumbers></contact><contact><id>144596940424</id><image>image/anonymous.png</image><firstName>Theo</firstName><lastName>Walcott</lastName><gender>M</gender><nickName>Theo</nickName><dateOfBirth>2009-12-09</dateOfBirth><postalDetails><city>London</city><street>Mike jagger str</street><postalCode>45454367</postalCode><country>England</country></postalDetails><emails><officeEmail>theo@gmail.com</officeEmail><privateEmail>walcot@arsenal.com</privateEmail></emails><telephoneNumbers><privateMobile>56789012</privateMobile><office>1234567</office></telephoneNumbers></contact><contact><id>144596980323</id><image>image/anonymous.png</image><firstName>Aaroon</firstName><lastName>Ramsey</lastName><gender>M</gender><nickName>Rambo</nickName><dateOfBirth>2001-12-01</dateOfBirth><postalDetails><city>fewf</city><street>erewfe</street><postalCode>123124</postalCode><country>Wales</country></postalDetails><emails><officeEmail>ramsey@yahoo.com</officeEmail><privateEmail>ramsey@arsenal.com</privateEmail></emails><telephoneNumbers><privateMobile>51234567</privateMobile><office>1234567</office></telephoneNumbers></contact><contact><id>144597043270</id><image>image/anonymous.png</image><firstName>Bellerin</firstName><lastName>Hector</lastName><gender>M</gender><nickName>Ferari</nickName><dateOfBirth>2004-12-06</dateOfBirth><postalDetails><city>Barcelona</city><street>barcelona Str.</street><postalCode>44343</postalCode><country>Spain</country></postalDetails><emails><officeEmail>bellerin@gmail.com</officeEmail><privateEmail>Hector@arsenal.com</privateEmail></emails><telephoneNumbers><privateMobile>56789012</privateMobile><office>1234678</office></telephoneNumbers></contact><contact><id>14459709488</id><image>image/anonymous.png</image><firstName>Petr</firstName><lastName>Cech</lastName><gender>M</gender><nickName>the wall</nickName><dateOfBirth>2013-03-15</dateOfBirth><postalDetails><city>Mos</city><street>Cheque </street><postalCode>efefe</postalCode><country>USA</country></postalDetails><emails><officeEmail>petr@gmail.com</officeEmail><privateEmail>check@arsenal.com</privateEmail></emails><telephoneNumbers><privateMobile>56787908</privateMobile><office>1234790</office></telephoneNumbers></contact></contactLists>
