<?xml version="1.0" encoding="UTF-8"?>
<contactLists xmlns:xsi="http://www.w3.org/2001/XMLSchema-instance" xsi:noNamespaceSchemaLocation="contactListSchema.xsd"><contact><id>140315</id><image>image/sanchez.jpg</image><firstName>Janny</firstName><lastName>Doe</lastName><gender>M</gender><nickName>jD</nickName><dateOfBirth>2002-12-12</dateOfBirth><postalDetails><city>mahe</city><street>rue la hiiix</street><postalCode>uyuiui</postalCode><country>Austrailia</country></postalDetails><emails><officeEmail>dert@yahoo.com</officeEmail><privateEmail>frtyuio@yahoo.com</privateEmail></emails><telephoneNumbers><privateMobile>56782345</privateMobile><office>4535655</office></telephoneNumbers></contact><contact><id>3rfrf</id><image>image/sanchez.jpg</image><firstName>Anneilla</firstName><lastName>Marine</lastName><gender>F</gender><nickName>Ann.Mary</nickName><dateOfBirth>2002-12-12</dateOfBirth><postalDetails><city>paris</city><street>rue la place</street><postalCode>566473few</postalCode><country>Brazil</country></postalDetails><emails><officeEmail>paris@yahoo.com</officeEmail><privateEmail>drake@yahoo.com</privateEmail></emails><telephoneNumbers><privateMobile>51234567</privateMobile><office>7654321</office></telephoneNumbers></contact><contact><id>144447983972</id><image>image/download_(2).jpg</image><firstName>Blais</firstName><lastName>Francoise</lastName><gender>F</gender><nickName>fb</nickName><dateOfBirth>2012-12-12</dateOfBirth><postalDetails><city>grand-port/mahebourg</city><street>rue boulangerie ville-noire,mahebourg</street><postalCode>742CU001</postalCode><country>Austrailia</country></postalDetails><emails><officeEmail>dylanblais1@hotmail.com</officeEmail><privateEmail>dylanblais1@hotmail.com</privateEmail></emails><telephoneNumbers><privateMobile>56310814</privateMobile><office>6310814</office></telephoneNumbers></contact><contact><id>144447998052</id><image>image/user_add_man_male_profile_account_person-512.png</image><firstName>Blais</firstName><lastName>Francoise</lastName><gender>M</gender><nickName>DB</nickName><dateOfBirth>2012-12-12</dateOfBirth><postalDetails><city>grand-port/mahebourg</city><street>rue boulangerie ville-noire,mahebourg</street><postalCode>742CU001</postalCode><country>Mauritius</country></postalDetails><emails><officeEmail>dylanblais1@hotmail.com</officeEmail><privateEmail>dylanblais1@hotmail.com</privateEmail></emails><telephoneNumbers><privateMobile>56310814</privateMobile><office>6310814</office></telephoneNumbers></contact><contact><id>144525632316</id><image>image/anonymous.png</image><firstName>Matudi</firstName><lastName>Blaize</lastName><gender>M</gender><nickName>charo</nickName><dateOfBirth>2012-02-02</dateOfBirth><postalDetails><city>Paris</city><street>Rue Margeot</street><postalCode>tt5445654btgr</postalCode><country>France</country></postalDetails><emails><officeEmail>matudi@gmail.com</officeEmail><privateEmail>blaize@you.fr</privateEmail></emails><telephoneNumbers><privateMobile>51234567</privateMobile><office>1234567</office></telephoneNumbers></contact><contact><id>144525632412</id><image>image/anonymous.png</image><firstName>Matudi</firstName><lastName>Blaize</lastName><gender>M</gender><nickName>charo</nickName><dateOfBirth>2012-02-02</dateOfBirth><postalDetails><city>Paris</city><street>Rue Margeot</street><postalCode>tt5445654btgr</postalCode><country>France</country></postalDetails><emails><officeEmail>matudi@gmail.com</officeEmail><privateEmail>blaize@you.fr</privateEmail></emails><telephoneNumbers><privateMobile>51234567</privateMobile><office>1234567</office></telephoneNumbers></contact><contact><id>144525632466</id><image>image/anonymous.png</image><firstName>Matudi</firstName><lastName>Blaize</lastName><gender>M</gender><nickName>charo</nickName><dateOfBirth>2012-02-02</dateOfBirth><postalDetails><city>Paris</city><street>Rue Margeot</street><postalCode>tt5445654btgr</postalCode><country>France</country></postalDetails><emails><officeEmail>matudi@gmail.com</officeEmail><privateEmail>blaize@you.fr</privateEmail></emails><telephoneNumbers><privateMobile>51234567</privateMobile><office>1234567</office></telephoneNumbers></contact><contact><id>144525632473</id><image>image/anonymous.png</image><firstName>Matudi</firstName><lastName>Blaize</lastName><gender>M</gender><nickName>charo</nickName><dateOfBirth>2012-02-02</dateOfBirth><postalDetails><city>Paris</city><street>Rue Margeot</street><postalCode>tt5445654btgr</postalCode><country>France</country></postalDetails><emails><officeEmail>matudi@gmail.com</officeEmail><privateEmail>blaize@you.fr</privateEmail></emails><telephoneNumbers><privateMobile>51234567</privateMobile><office>1234567</office></telephoneNumbers></contact><contact><id>144525632449</id><image>image/anonymous.png</image><firstName>Matudi</firstName><lastName>Blaize</lastName><gender>M</gender><nickName>charo</nickName><dateOfBirth>2012-02-02</dateOfBirth><postalDetails><city>Paris</city><street>Rue Margeot</street><postalCode>tt5445654btgr</postalCode><country>France</country></postalDetails><emails><officeEmail>matudi@gmail.com</officeEmail><privateEmail>blaize@you.fr</privateEmail></emails><telephoneNumbers><privateMobile>51234567</privateMobile><office>1234567</office></telephoneNumbers></contact><contact><id>144525632492</id><image>image/anonymous.png</image><firstName>Matudi</firstName><lastName>Blaize</lastName><gender>M</gender><nickName>charo</nickName><dateOfBirth>2012-02-02</dateOfBirth><postalDetails><city>Paris</city><street>Rue Margeot</street><postalCode>tt5445654btgr</postalCode><country>France</country></postalDetails><emails><officeEmail>matudi@gmail.com</officeEmail><privateEmail>blaize@you.fr</privateEmail></emails><telephoneNumbers><privateMobile>51234567</privateMobile><office>1234567</office></telephoneNumbers></contact><contact><id>144525632590</id><image>image/anonymous.png</image><firstName>Matudi</firstName><lastName>Blaize</lastName><gender>M</gender><nickName>charo</nickName><dateOfBirth>2012-02-02</dateOfBirth><postalDetails><city>Paris</city><street>Rue Margeot</street><postalCode>tt5445654btgr</postalCode><country>France</country></postalDetails><emails><officeEmail>matudi@gmail.com</officeEmail><privateEmail>blaize@you.fr</privateEmail></emails><telephoneNumbers><privateMobile>51234567</privateMobile><office>1234567</office></telephoneNumbers></contact><contact><id>144525632589</id><image>image/anonymous.png</image><firstName>Matudi</firstName><lastName>Blaize</lastName><gender>M</gender><nickName>charo</nickName><dateOfBirth>2012-02-02</dateOfBirth><postalDetails><city>Paris</city><street>Rue Margeot</street><postalCode>tt5445654btgr</postalCode><country>France</country></postalDetails><emails><officeEmail>matudi@gmail.com</officeEmail><privateEmail>blaize@you.fr</privateEmail></emails><telephoneNumbers><privateMobile>51234567</privateMobile><office>1234567</office></telephoneNumbers></contact></contactLists>
